{
  "schema": "lonewolf.file_queue.supervised_dry_run_result.v1",
  "build_id": "20260613_codex_native_automation_gate_contracts_v1",
  "request_id": "supervised_dry_run_request_appdata_packet_creation_review_only",
  "chain_id": "chain_supervised_dry_run_contracts_v1",
  "task_id": "task_supervised_dry_run_contracts_v1",
  "status": "DRY_RUN_REVIEW_PACKET_CREATED",
  "accepted": true,
  "reasons": [
    "Review packet evidence was created and owner review remains required."
  ],
  "operation_class": "APPDATA_PACKET_CREATION_REVIEW_ONLY",
  "task_json_sha256": "AAAAAAAAAAAAAAAAAAAAAAAAAAAAAAAAAAAAAAAAAAAAAAAAAAAAAAAAAAAAAAAA",
  "validator_report_sha256": "BBBBBBBBBBBBBBBBBBBBBBBBBBBBBBBBBBBBBBBBBBBBBBBBBBBBBBBBBBBBBBBB",
  "output_packet_path": "C:\\Users\\yu_ki\\AppData\\Local\\LoneWolfFang\\data\\supervised_dry_run_packet.zip",
  "output_packet_sha256": "CCCCCCCCCCCCCCCCCCCCCCCCCCCCCCCCCCCCCCCCCCCCCCCCCCCCCCCCCCCCCCCC",
  "checked_at": "2026-06-13T07:22:57Z",
  "owner_gate_after_dry_run": true,
  "owner_gate_before_next_task_generation": true,
  "no_repetition_started": true,
  "no_runtime_or_persistent_watcher": true,
  "no_executor_approval": true,
  "no_task_execution": true,
  "safety_summary": {
    "local_only": true,
    "appdata_or_test_temp_output_only": true,
    "no_executor_code": true,
    "no_task_execution": true,
    "no_shell_command_runner": true,
    "no_network": true,
    "no_private_api": true,
    "no_openai_api": true,
    "no_deploy": true,
    "no_cloud_mutation": true,
    "no_billing_mutation": true,
    "no_trading": true,
    "no_daemon_watcher": true,
    "no_ui_automation": true,
    "no_process_kill": true,
    "no_security_bypass": true,
    "no_repo_mutation": true,
    "no_secrets_output": true
  },
  "forbidden_actions_confirmation": {
    "forbidden_actions_performed": false,
    "confirmed_absent": [
      "executor_code",
      "task_execution",
      "shell_escape",
      "network_private_openai_api",
      "cloud_mutation",
      "billing_mutation",
      "daemon_watcher",
      "ui_automation",
      "paper_trading",
      "live_execution",
      "order_cancel_fetch_balance"
    ]
  },
  "next_recommended_action": "OWNER_REVIEW_REQUIRED",
  "human_review_one_point": "Decide whether the review packet evidence is complete enough for the next bounded docs/schema/tests/fixtures lane."
}
